{
  "$schema": "https://json-schema.org/draft/2020-12/schema",
  "$id": "openmontage/artifacts/script",
  "title": "Production Script",
  "description": "Timestamped script produced by the Script Writer agent.",
  "type": "object",
  "required": ["version", "title", "total_duration_seconds", "narration_language", "paragraph_structure", "sections"],
  "properties": {
    "version": { "type": "string", "const": "1.0" },
    "title": { "type": "string" },
    "narration_language": {
      "type": "string",
      "enum": ["en", "zh"],
      "description": "Primary language of the narration"
    },
    "paragraph_structure": {
      "type": "object",
      "required": ["mode", "compressed_to", "rationale"],
      "properties": {
        "mode": {
          "type": "string",
          "enum": ["six-act"],
          "description": "Underlying narrative structure applied as a content checklist"
        },
        "compressed_to": {
          "type": "integer",
          "enum": [3, 4, 5, 6],
          "description": "Number of paragraphs actually produced for the target duration"
        },
        "rationale": { "type": "string" }
      },
      "additionalProperties": false
    },
    "total_duration_seconds": { "type": "number", "minimum": 1 },
    "word_count": {
      "type": "object",
      "required": ["target", "actual", "unit"],
      "properties": {
        "target": { "type": "integer", "minimum": 1 },
        "actual": { "type": "integer", "minimum": 1 },
        "unit": { "type": "string", "enum": ["words", "chars"] }
      },
      "additionalProperties": false
    },
    "voice_performance": {
      "type": "object",
      "description": "Narration delivery contract used by TTS asset generation.",
      "properties": {
        "performance_intent": { "type": "string" },
        "pacing_profile": {
          "type": "string",
          "enum": ["contemplative", "conversational", "energetic", "technical", "cinematic", "custom"]
        },
        "energy_curve": { "type": "string" },
        "pause_policy": { "type": "string" },
        "sample_section_id": {
          "type": "string",
          "description": "Most performance-sensitive section to use for TTS sample approval."
        },
        "provider_notes": {
          "type": "object",
          "additionalProperties": { "type": "string" }
        }
      },
      "additionalProperties": false
    },
    "sections": {
      "type": "array",
      "items": {
        "type": "object",
        "required": ["id", "text", "paragraph_label", "start_seconds", "end_seconds"],
        "properties": {
          "id": { "type": "string" },
          "label": { "type": "string" },
          "paragraph_label": {
            "type": "string",
            "enum": ["viral_hook", "quick_intro", "main_story", "turning_point", "big_picture", "powerful_ending", "viral_hook+quick_intro", "big_picture+powerful_ending"],
            "description": "Which six-act paragraph this section belongs to. Compound labels are used when compressed paragraph structure merges adjacent paragraphs."
          },
          "text": { "type": "string" },
          "start_seconds": { "type": "number", "minimum": 0 },
          "end_seconds": { "type": "number", "minimum": 0 },
          "speaker_directions": { "type": "string" },
          "delivery_cues": {
            "type": "object",
            "description": "Structured voice-performance cues that TTS generation must apply.",
            "properties": {
              "pace": {
                "type": "string",
                "enum": ["slow", "measured", "conversational", "brisk", "fast", "custom"]
              },
              "energy": { "type": "string" },
              "emphasis_words": {
                "type": "array",
                "items": { "type": "string" }
              },
              "pause_before_seconds": { "type": "number", "minimum": 0 },
              "pause_after_seconds": { "type": "number", "minimum": 0 },
              "delivery_note": { "type": "string" },
              "provider_text": {
                "type": "string",
                "description": "Provider-ready narration text, including purposeful punctuation or SSML break tags when supported."
              }
            },
            "additionalProperties": false
          },
          "enhancement_cues": {
            "type": "array",
            "items": {
              "type": "object",
              "properties": {
                "type": { "type": "string", "enum": ["overlay", "broll", "diagram", "stat_card", "code_snippet", "animation"] },
                "description": { "type": "string" },
                "timestamp_seconds": { "type": "number" }
              },
              "required": ["type", "description"]
            }
          },
          "pronunciation_guides": {
            "type": "array",
            "items": {
              "type": "object",
              "properties": {
                "word": { "type": "string" },
                "phonetic": { "type": "string" }
              },
              "required": ["word", "phonetic"]
            }
          },
          "source_ref": {
            "type": "string",
            "description": "Reference to the research_brief data point or URL that supports this claim. Every factual claim should be traceable."
          }
        },
        "additionalProperties": false
      },
      "minItems": 1
    },
    "metadata": { "type": "object" }
  },
  "additionalProperties": false
}
